{
  "schema": "bold.toolchain-lock/1",
  "lock_status": "PINNED",
  "notes": "Lock gerado por setup/lock-gen.mjs a partir de METADADOS oficiais (nenhum binário baixado). sha256 fixado e REVISADO pelo mantenedor (TOFU via HTTPS); assinatura GPG do Node NÃO verificada. Layout interno dos arquivos e assinaturas de código confirmados só na Fase 5 (E2E isolado). Chrome headless e whisper.cpp seguem pendentes (Fase 4).",
  "generated": {
    "at": "2026-10-15T02:16:27.423Z",
    "tool": "setup/lock-gen.mjs",
    "method": "metadados públicos oficiais (GET de listas/JSON + HEAD); nenhum binário baixado",
    "trust": {
      "model": "TOFU do mantenedor",
      "sha256": "lido por HTTPS das listas oficiais (SHASUMS256.txt · *.sha256 do Riedl · digest da API do GitHub conferido com checksums.sha256)",
      "gpg": "não verificado",
      "review": "revisado pelo mantenedor no GATE da R12.3"
    },
    "sources": [
      {
        "component": "node",
        "version": "24.22.0",
        "release_date": "2026-10-14",
        "lts": "Krypton",
        "security_release": false,
        "index": "https://nodejs.org/dist/index.json",
        "checksums": "https://nodejs.org/dist/v24.22.0/SHASUMS256.txt",
        "checksums_sha256": "8912ada1431af8390bb3e30328d30bca701b59c7a6d5396b491293515c092c46",
        "signature": {
          "detached": "https://nodejs.org/dist/v24.22.0/SHASUMS256.txt.sig",
          "clearsigned": "https://nodejs.org/dist/v24.22.0/SHASUMS256.txt.asc",
          "available": true,
          "verified": false,
          "note": "assinatura GPG NÃO verificada (sem gpg; decisão R12.3) — confiança: TOFU do mantenedor via HTTPS"
        }
      },
      {
        "component": "ffmpeg",
        "platform": "darwin-arm64",
        "provider": "Martin Riedl",
        "release": "9.0.2",
        "build_timestamp": 1789931890,
        "page": "https://ffmpeg.martin-riedl.de/",
        "checksums": [
          "https://ffmpeg.martin-riedl.de/download/macos/arm64/1789931890_9.0.2/ffmpeg.zip.sha256",
          "https://ffmpeg.martin-riedl.de/download/macos/arm64/1789931890_9.0.2/ffprobe.zip.sha256"
        ],
        "build_info": "https://ffmpeg.martin-riedl.de/download/macos/arm64/1789931890_9.0.2/versions.txt",
        "license_from_configure": "GPL-3.0-or-later",
        "prores_ks": true,
        "signed_claim": true
      },
      {
        "component": "ffmpeg",
        "platform": "win32-x64",
        "provider": "BtbN/FFmpeg-Builds",
        "tag": "autobuild-2026-09-30-13-08",
        "published_at": "2026-09-30T13:09:24Z",
        "asset": "ffmpeg-n9.0.2-17-g2a571b6068-win64-lgpl-9.0.zip",
        "api": "https://api.github.com/repos/BtbN/FFmpeg-Builds/releases?per_page=100",
        "digest_source": "GitHub API asset.digest",
        "cross_check": "https://github.com/BtbN/FFmpeg-Builds/releases/download/autobuild-2026-09-30-13-08/checksums.sha256",
        "redirect_hosts": [
          "github.com",
          "release-assets.githubusercontent.com"
        ]
      }
    ],
    "optional": {
      "at": "2026-10-15T02:44:27.147Z",
      "tool": "setup/lock-gen-optional.mjs",
      "method": "metadados públicos (APIs GitHub/PyPI/Hugging Face/npm + HEAD); nenhum binário, wheel, modelo ou tarball baixado",
      "sources": [
        {
          "component": "pillow",
          "pbs_release": "20261013",
          "python_series": "3.12",
          "pillow": "12.3.0",
          "pbs_checksums": "https://github.com/astral-sh/python-build-standalone/releases/download/20261013/SHA256SUMS",
          "pypi": "https://pypi.org/pypi/pillow/json",
          "darwin-arm64": {
            "python": "cpython-3.12.15+20261013-aarch64-apple-darwin-install_only.tar.gz",
            "wheel": "pillow-12.3.0-cp312-cp312-macosx_11_0_arm64.whl",
            "redirect_hosts": [
              "github.com",
              "release-assets.githubusercontent.com"
            ]
          },
          "darwin-x64": {
            "python": "cpython-3.12.15+20261013-x86_64-apple-darwin-install_only.tar.gz",
            "wheel": "pillow-12.3.0-cp312-cp312-macosx_10_13_x86_64.whl",
            "redirect_hosts": [
              "github.com",
              "release-assets.githubusercontent.com"
            ]
          },
          "win32-x64": {
            "python": "cpython-3.12.15+20261013-x86_64-pc-windows-msvc-install_only.tar.gz",
            "wheel": "pillow-12.3.0-cp312-cp312-win_amd64.whl",
            "redirect_hosts": [
              "github.com",
              "release-assets.githubusercontent.com"
            ]
          }
        },
        {
          "component": "whisper-cli",
          "tag": "b4938",
          "published_at": "2026-08-20T11:33:19Z",
          "asset": "whisper-bin-x64.zip",
          "digest_source": "GitHub API asset.digest",
          "redirect_hosts": [
            "github.com",
            "release-assets.githubusercontent.com"
          ]
        },
        {
          "component": "whisper-model",
          "repo": "ggerganov/whisper.cpp",
          "commit": "5359861c739e955e79d9a303bcbc70fb988958b1",
          "license": "MIT",
          "base": {
            "file": "ggml-base.bin",
            "size": 147951465,
            "etag_matches_lfs_oid": true,
            "redirect_hosts": [
              "huggingface.co",
              "us.aws.cdn.hf.co"
            ]
          },
          "small": {
            "file": "ggml-small.bin",
            "size": 487601967,
            "etag_matches_lfs_oid": true,
            "redirect_hosts": [
              "huggingface.co",
              "us.aws.cdn.hf.co"
            ]
          },
          "medium": {
            "file": "ggml-medium.bin",
            "size": 1533763059,
            "etag_matches_lfs_oid": true,
            "redirect_hosts": [
              "huggingface.co",
              "us.aws.cdn.hf.co"
            ]
          }
        },
        {
          "component": "hyperframes",
          "method": "npm install --package-lock-only --ignore-scripts (cache/config isolados; nenhum tarball)",
          "registry": "https://registry.npmjs.org/",
          "packages": 123,
          "lockfile_sha256": "aa3a727fece75296d0e31c43208719af764eb0fb74c8c78053f1fa8514636f22"
        },
        {
          "component": "remotion",
          "method": "npm install --package-lock-only --ignore-scripts (cache/config isolados; nenhum tarball)",
          "registry": "https://registry.npmjs.org/",
          "packages": 203,
          "lockfile_sha256": "5a5622b01578a6fa15ce433cf9a315fa653bd034542710641cfc038e389a5f67"
        }
      ]
    }
  },
  "components": {
    "node": {
      "version": "24.22.0",
      "license": "MIT",
      "source": {
        "kind": "official",
        "site": "https://nodejs.org/dist/",
        "checksums": "SHASUMS256.txt",
        "signature": "SHASUMS256.txt.sig/.asc (disponível; NÃO verificada)"
      },
      "platforms": {
        "darwin-arm64": {
          "status": "PINNED",
          "support": "SUPPORTED",
          "provider": "nodejs.org (oficial)",
          "artifact": "node-v24.22.0-darwin-arm64.tar.gz",
          "url": "https://nodejs.org/dist/v24.22.0/node-v24.22.0-darwin-arm64.tar.gz",
          "sha256": "6a9724d9b50a5f22b4816cded441b5a8d9ddae546191a5e5b7efa5a5e2ee26d5",
          "size": 53049576,
          "bins": {
            "node": "bin/node"
          },
          "format": "tar.gz",
          "strip_components": 1,
          "hosts": [
            "nodejs.org"
          ],
          "installed_size": 197365224,
          "layout_verified": true,
          "codesign": {
            "policy": "REQUIRED",
            "team_id": "HX7739G8FX",
            "authority": "Developer ID Application",
            "hardened_runtime": true,
            "bins": {
              "node": {
                "identifier": "node"
              }
            },
            "measured": "R12.5A (2026-10-15): Node.js Foundation; codesign --verify --strict OK"
          }
        },
        "darwin-x64": {
          "status": "PINNED",
          "support": "EXPERIMENTAL",
          "provider": "nodejs.org (oficial)",
          "artifact": "node-v24.22.0-darwin-x64.tar.gz",
          "url": "https://nodejs.org/dist/v24.22.0/node-v24.22.0-darwin-x64.tar.gz",
          "sha256": "495e3f273c645f3c4677d438304cdfc701729ea5dec5728f5c8e76a2dece4b91",
          "size": 54356645,
          "bins": {
            "node": "bin/node"
          },
          "format": "tar.gz",
          "strip_components": 1,
          "hosts": [
            "nodejs.org"
          ],
          "installed_size": null,
          "layout_verified": false,
          "codesign": {
            "policy": "PENDING_MEASUREMENT",
            "notes": "EXPERIMENTAL: assinatura do artefato x64 não medida em máquina real — instalação gerenciada indisponível até GATE"
          }
        },
        "win32-x64": {
          "status": "PINNED",
          "support": "EXPERIMENTAL",
          "provider": "nodejs.org (oficial)",
          "artifact": "node-v24.22.0-win-x64.zip",
          "url": "https://nodejs.org/dist/v24.22.0/node-v24.22.0-win-x64.zip",
          "sha256": "f9683a19877e12a9b167305c8db71040d812876359de21f0d2e97c3f321f80c3",
          "size": 37733703,
          "bins": {
            "node": "node.exe"
          },
          "format": "zip",
          "strip_components": 1,
          "hosts": [
            "nodejs.org"
          ],
          "installed_size": null,
          "layout_verified": false
        }
      }
    },
    "ffmpeg": {
      "version": "9.0.2",
      "license": "macOS arm64: GPL-3.0-or-later (Riedl, --enable-gpl --enable-version3) · Windows x64: LGPL-2.1-or-later (BtbN lgpl)",
      "license_notes": "Download direto do upstream na máquina do usuário; o BOLD não redistribui nem espelha binários (evita obrigações de oferta de fonte da GPL). prores_ks presente (verificado no codecs.txt do Riedl; nativo/LGPL no FFmpeg).",